{
  "$schema": "https://json-schema.org/draft/2020-12/schema",
  "title": "Gym",
  "type": "object",
  "additionalProperties": false,
  "required": [
    "_id",
    "name",
    "location",
    "leader_id"
  ],
  "properties": {
    "_id": {
      "type": "string"
    },
    "name": {
      "type": "string"
    },
    "location": {
      "type": "string"
    },
    "leader_id": {
      "type": "string"
    }
  }
}